{
  "source": "media/synthetic-talk.mp4",
  "duration_seconds": 34.8,
  "language": "en",
  "segments": [
    {
      "start": 0.0,
      "end": 2.66,
      "text": "Hi everyone, welcome back to the channel."
    },
    {
      "start": 2.66,
      "end": 8.98,
      "text": "Today I want to show you how to, um."
    },
    {
      "start": 8.98,
      "end": 14.76,
      "text": "Today I want to show you how to set up a local video editing pipeline."
    },
    {
      "start": 14.76,
      "end": 21.7,
      "text": "The first step is installing the editor, which is."
    },
    {
      "start": 21.7,
      "end": 27.44,
      "text": "The first step is installing Shotcut, which is free and open source."
    },
    {
      "start": 29.56,
      "end": 31.64,
      "text": "Okay, let's get started."
    }
  ],
  "silences": [
    {
      "start": 2.672,
      "end": 6.59
    },
    {
      "start": 9.013,
      "end": 11.129
    },
    {
      "start": 14.829,
      "end": 18.773
    },
    {
      "start": 21.718,
      "end": 23.43
    },
    {
      "start": 25.505,
      "end": 26.009
    },
    {
      "start": 27.528,
      "end": 29.918
    },
    {
      "start": 31.661,
      "end": 32.461
    }
  ]
}
